"DESCRIPTION","DURATION IN MS","NAME","PARENT SUITE","START TIME","STATUS","STOP TIME","SUB SUITE","SUITE","TEST CLASS","TEST METHOD"
"","3115","should display correct text for Help menu items","chromium","2026-02-05","passed","2026-02-05","All Menu Navigation Tests","","",""
"","13706","TC4: Validate file size limit (>1050KB)","chromium","2026-02-05","passed","2026-02-05","Bulk Scanning e2e","","",""
"","2165","should display all menu items","chromium","2026-02-05","passed","2026-02-05","Dashboard Page Tests","","",""
"","13115","Validate error message when iframe fails to load","chromium","2026-02-05","passed","2026-02-05","RCM Dashboard E2E","","",""
"","3307","should display all Admin1 submenu items","chromium","2026-02-05","passed","2026-02-05","All Menu Navigation Tests","","",""
"","3995","should be able to click Summary menu item","chromium","2026-02-05","passed","2026-02-05","Patient Menu Tests","","",""
"","353","should allow clearing username field","chromium","2026-02-05","passed","2026-02-05","Login Page Tests","","",""
"","2967","should display correct text for Receivable menu item","chromium","2026-02-05","passed","2026-02-05","Patient Menu Tests","","",""
"","6976","should be able to click Add Private button","chromium","2026-02-05","passed","2026-02-05","Patient Registration Tests","","",""
"","2073","should display navigation menu","chromium","2026-02-05","passed","2026-02-05","Dashboard Page Tests","","",""
"","39701","Complete patient registration workflow - Private patient","chromium","2026-02-05","passed","2026-02-05","Patient Registration E2E","","",""
"","640","should display error message with invalid credentials","chromium","2026-02-05","passed","2026-02-05","Login Page Tests","","",""
"","2856","should display System menu with correct item count","chromium","2026-02-05","passed","2026-02-05","All Menu Navigation Tests","","",""
"","7554","should display Admin2 menu with correct item count","chromium","2026-02-05","passed","2026-02-05","All Menu Navigation Tests","","",""
"","631","should display username input field","chromium","2026-02-05","passed","2026-02-05","Login Page Tests","","",""
"","17688","TC3: Upload valid document types","chromium","2026-02-05","passed","2026-02-05","Bulk Scanning e2e","","",""
"","8910","TC1-2: Verify 5 fields are disabled initially","chromium","2026-02-05","passed","2026-02-05","Bulk Scanning e2e","","",""
"","3547","should have correct count of Patient menu items","chromium","2026-02-05","passed","2026-02-05","Patient Menu Tests","","",""
"","19899","TC5-6: Select file, verify fields enabled, and search patient","chromium","2026-02-05","passed","2026-02-05","Bulk Scanning e2e","","",""
"","36610","Patient registration workflow - EPS patient","chromium","2026-02-05","passed","2026-02-05","Patient Registration E2E","","",""
"","4","should have all PDF test files","chromium","2026-02-05","passed","2026-02-05","Test Files - File Type Validation","","",""
"","11128","should successfully upload TIFF file","chromium","2026-02-05","passed","2026-02-05","Bulk Scanning e2e","","",""
"","4410","should be able to click Log Book menu item","chromium","2026-02-05","passed","2026-02-05","Patient Menu Tests","","",""
"","3897","should be able to click Personal Profile menu item","chromium","2026-02-05","passed","2026-02-05","All Menu Navigation Tests","","",""
"","490","should show password field after entering username","chromium","2026-02-05","passed","2026-02-05","Login Page Tests","","",""
"","10502","should successfully upload PNG file","chromium","2026-02-05","passed","2026-02-05","Bulk Scanning e2e","","",""
"","4567","should fill out patient registration form with required fields","chromium","2026-02-05","passed","2026-02-05","Patient Registration Tests","","",""
"","28828","TC8: Search patient by Last Name and DOB","chromium","2026-02-05","passed","2026-02-05","Bulk Scanning e2e","","",""
"","4","should list all available test files","chromium","2026-02-05","passed","2026-02-05","Test Files Verification","","",""
"","3093","should display Resource menu with correct item count","chromium","2026-02-05","passed","2026-02-05","All Menu Navigation Tests","","",""
"","4569","should display all Add buttons for different patient types","chromium","2026-02-05","passed","2026-02-05","Patient Registration Tests","","",""
"","10841","should successfully upload TIF file","chromium","2026-02-05","passed","2026-02-05","Bulk Scanning e2e","","",""
"","2732","should display Help menu with correct item count","chromium","2026-02-05","passed","2026-02-05","All Menu Navigation Tests","","",""
"","2","should verify fixtures directory structure","chromium","2026-02-05","passed","2026-02-05","Test Files Verification","","",""
"","10173","should successfully upload JPG file","chromium","2026-02-05","passed","2026-02-05","Bulk Scanning e2e","","",""
"","12348","should successfully upload JFIF file","chromium","2026-02-05","passed","2026-02-05","Bulk Scanning e2e","","",""
"","3174","should display Personal menu with correct item count","chromium","2026-02-05","passed","2026-02-05","All Menu Navigation Tests","","",""
"","3103","should successfully login with valid credentials","chromium","2026-02-05","passed","2026-02-05","Login Page Tests","","",""
"","1","should have all PNG test files","chromium","2026-02-05","passed","2026-02-05","Test Files - File Type Validation","","",""
"","3810","should be able to click Demographic menu item","chromium","2026-02-05","passed","2026-02-05","Patient Menu Tests","","",""
"","2106","should display logout button on dashboard","chromium","2026-02-05","passed","2026-02-05","Dashboard Page Tests","","",""
"","3428","should display correct text for Payer/Insurance menu item","chromium","2026-02-05","passed","2026-02-05","Patient Menu Tests","","",""
"","3365","should display correct text for Log Book menu item","chromium","2026-02-05","passed","2026-02-05","Patient Menu Tests","","",""
"","8059","should register a new private patient with complete information","chromium","2026-02-05","passed","2026-02-05","Patient Registration Tests","","",""
"","2","should verify large file exceeds 1050KB limit","chromium","2026-02-05","passed","2026-02-05","Test Files Verification","","",""
"","34040","TC9: Associate document to Patient via +Pat Docs","chromium","2026-02-05","passed","2026-02-05","Bulk Scanning e2e","","",""
"","4573","should display patient registration form after clicking Add Private","chromium","2026-02-05","passed","2026-02-05","Patient Registration Tests","","",""
"","12847","should successfully upload JPEG file","chromium","2026-02-05","passed","2026-02-05","Bulk Scanning e2e","","",""
"","13456","Validate RCM Dashboard visibility for practices with and without permissions","chromium","2026-02-05","passed","2026-02-05","RCM Dashboard E2E","","",""
"","3425","should display correct text for Resource menu items","chromium","2026-02-05","passed","2026-02-05","All Menu Navigation Tests","","",""
"","6998","should navigate to patient registration when clicking Add Private","chromium","2026-02-05","passed","2026-02-05","Patient Registration Tests","","",""
"","8","should verify file extensions match content type","chromium","2026-02-05","passed","2026-02-05","Test Files Verification","","",""
"","3237","should display all Patient submenu items","chromium","2026-02-05","passed","2026-02-05","Patient Menu Tests","","",""
"","307","should accept and retain username input value","chromium","2026-02-05","passed","2026-02-05","Login Page Tests","","",""
"","8509","should display Admin1 menu with correct item count","chromium","2026-02-05","passed","2026-02-05","All Menu Navigation Tests","","",""
"","2","should have all TIFF/TIF test files","chromium","2026-02-05","passed","2026-02-05","Test Files - File Type Validation","","",""
"","10887","should successfully upload GIF file","chromium","2026-02-05","passed","2026-02-05","Bulk Scanning e2e","","",""
"","3219","should display correct text for Carequality menu item","chromium","2026-02-05","passed","2026-02-05","Patient Menu Tests","","",""
"","37886","Patient registration workflow - Worker Comp patient","chromium","2026-02-05","passed","2026-02-05","Patient Registration E2E","","",""
"","338","should display next button","chromium","2026-02-05","passed","2026-02-05","Login Page Tests","","",""
"","9835","should be able to cancel patient registration","chromium","2026-02-05","passed","2026-02-05","Patient Registration Tests","","",""
"","11","should have all required test files","chromium","2026-02-05","passed","2026-02-05","Test Files Verification","","",""
"","12384","Test Upload Button Click","chromium","2026-02-05","passed","2026-02-05","","","",""
"","2","should have all JFIF test files","chromium","2026-02-05","passed","2026-02-05","Test Files - File Type Validation","","",""
"","13","should verify file sizes are correct","chromium","2026-02-05","passed","2026-02-05","Test Files Verification","","",""
"","3545","should display correct text for Demographic menu item","chromium","2026-02-05","passed","2026-02-05","Patient Menu Tests","","",""
"","5581","should display practice dropdown","chromium","2026-02-05","passed","2026-02-05","Patient Registration Tests","","",""
"","5285","should display Log Book page","chromium","2026-02-05","passed","2026-02-05","Patient Registration Tests","","",""
"","3337","should display correct text for Scan Documents menu item","chromium","2026-02-05","passed","2026-02-05","Patient Menu Tests","","",""
"","3421","should display correct text for Summary menu item","chromium","2026-02-05","passed","2026-02-05","Patient Menu Tests","","",""
"","10499","should successfully upload PDF file","chromium","2026-02-05","passed","2026-02-05","Bulk Scanning e2e","","",""
"","3","should have all GIF test files","chromium","2026-02-05","passed","2026-02-05","Test Files - File Type Validation","","",""
"","19","should verify file permissions are readable","chromium","2026-02-05","passed","2026-02-05","Test Files Verification","","",""
"","4","should have all JPEG/JPG test files","chromium","2026-02-05","passed","2026-02-05","Test Files - File Type Validation","","",""
